{
  "name": "BeatBot Genesis #882",
  "symbol": "BEAT",
  "description": "BeatBot Genesis #882 of the 140 Dub Operators. Built to dominate the rhythm battlefield with 20 Double-Bin Frenzy (8-Bit Arp + Screen Earthquake).",
  "seller_fee_basis_points": 500,
  "image": "882.jpg",
  "external_url": "https://playbeatbots.com",
  "attributes": [
    {
      "trait_type": "Clan",
      "value": "140 Dub Operators"
    },
    {
      "trait_type": "Rarity Tier",
      "value": "Rare Specialist"
    },
    {
      "trait_type": "Visual Edition",
      "value": "V1 OG TUBE RIG"
    },
    {
      "trait_type": "Head Chassis",
      "value": "12AX7 Crown Vacuum Tubes"
    },
    {
      "trait_type": "Audio Chest Rig",
      "value": "20 Double-Bin Subwoofer Wall"
    },
    {
      "trait_type": "Stage Backdrop",
      "value": "Underground Concrete Sub-Basement"
    },
    {
      "trait_type": "Battle Ability",
      "value": "20 Double-Bin Frenzy (8-Bit Arp + Screen Earthquake)"
    },
    {
      "trait_type": "Sound Profile",
      "value": "30Hz Sine Sub Drops & 140 Deep Dub Sirens"
    },
    {
      "trait_type": "Base BPM",
      "value": "140",
      "display_type": "number"
    },
    {
      "trait_type": "Audio Stem",
      "value": "Stem 02: 140 Dub Siren Stomp"
    },
    {
      "trait_type": "Attack",
      "value": "92",
      "display_type": "number"
    },
    {
      "trait_type": "Defense",
      "value": "98",
      "display_type": "number"
    },
    {
      "trait_type": "Speed",
      "value": "88",
      "display_type": "number"
    },
    {
      "trait_type": "Power Rating",
      "value": "278",
      "display_type": "number"
    },
    {
      "trait_type": "Generation",
      "value": "Genesis"
    }
  ],
  "collection": {
    "name": "BeatBots Genesis",
    "family": "BeatBots"
  },
  "properties": {
    "files": [
      {
        "uri": "882.jpg",
        "type": "image/jpeg"
      }
    ],
    "category": "image",
    "creators": [
      {
        "address": "3v2VAud6JVQ62EuRaTRkKuswKJCvgaAUEJce8A1US68d",
        "share": 85
      },
      {
        "address": "CnTMpsERhBucZwFngRny36fSfMasJ4zCisJctmUoPqMQ",
        "share": 15
      }
    ]
  }
}
