{
  "name": "BeatBot Genesis #407",
  "symbol": "BEAT",
  "description": "BeatBot Genesis #407 of the Industrial Mecha. Built to dominate the rhythm battlefield with Distortion Surge (Absorbs 1 Missed Beat per Match).",
  "seller_fee_basis_points": 500,
  "image": "407.jpg",
  "external_url": "https://playbeatbots.com",
  "attributes": [
    {
      "trait_type": "Clan",
      "value": "Industrial Mecha"
    },
    {
      "trait_type": "Rarity Tier",
      "value": "Core Battler"
    },
    {
      "trait_type": "Visual Edition",
      "value": "V1 DARK BUNKER EDITION"
    },
    {
      "trait_type": "Head Chassis",
      "value": "Weathered Gunmetal Mecha Visor"
    },
    {
      "trait_type": "Audio Chest Rig",
      "value": "Overhead Foundry Crane Rig"
    },
    {
      "trait_type": "Stage Backdrop",
      "value": "Remix Scrap Yard"
    },
    {
      "trait_type": "Battle Ability",
      "value": "Distortion Surge (Absorbs 1 Missed Beat per Match)"
    },
    {
      "trait_type": "Sound Profile",
      "value": "Distorted Power Chords & Downbeat Industrial Drums"
    },
    {
      "trait_type": "Base BPM",
      "value": "105",
      "display_type": "number"
    },
    {
      "trait_type": "Audio Stem",
      "value": "Stem 03: Remix-Era Turntable Scrub"
    },
    {
      "trait_type": "Attack",
      "value": "99",
      "display_type": "number"
    },
    {
      "trait_type": "Defense",
      "value": "96",
      "display_type": "number"
    },
    {
      "trait_type": "Speed",
      "value": "85",
      "display_type": "number"
    },
    {
      "trait_type": "Power Rating",
      "value": "280",
      "display_type": "number"
    },
    {
      "trait_type": "Generation",
      "value": "Genesis"
    }
  ],
  "collection": {
    "name": "BeatBots Genesis",
    "family": "BeatBots"
  },
  "properties": {
    "files": [
      {
        "uri": "407.jpg",
        "type": "image/jpeg"
      }
    ],
    "category": "image",
    "creators": [
      {
        "address": "3v2VAud6JVQ62EuRaTRkKuswKJCvgaAUEJce8A1US68d",
        "share": 85
      },
      {
        "address": "CnTMpsERhBucZwFngRny36fSfMasJ4zCisJctmUoPqMQ",
        "share": 15
      }
    ]
  }
}
