{
  "name": "BeatBot Genesis #648",
  "symbol": "BEAT",
  "description": "BeatBot Genesis #648 of the Intergalactic B-Boys. Built to dominate the rhythm battlefield with Scratch Fader Stutter (-15% Opponent Combo).",
  "seller_fee_basis_points": 500,
  "image": "648.jpg",
  "external_url": "https://playbeatbots.com",
  "attributes": [
    {
      "trait_type": "Clan",
      "value": "Intergalactic B-Boys"
    },
    {
      "trait_type": "Rarity Tier",
      "value": "Legendary Master"
    },
    {
      "trait_type": "Visual Edition",
      "value": "V2 TURNTABLE VARIANT"
    },
    {
      "trait_type": "Head Chassis",
      "value": "Intergalactic Antenna Ears"
    },
    {
      "trait_type": "Audio Chest Rig",
      "value": "Analog VU-Meter Speaker Chest"
    },
    {
      "trait_type": "Stage Backdrop",
      "value": "Neon Turntable Plinth"
    },
    {
      "trait_type": "Battle Ability",
      "value": "Scratch Fader Stutter (-15% Opponent Combo)"
    },
    {
      "trait_type": "Sound Profile",
      "value": "4/4 Funk Breaks & Vinyl Scratch Cuts"
    },
    {
      "trait_type": "Base BPM",
      "value": "96",
      "display_type": "number"
    },
    {
      "trait_type": "Audio Stem",
      "value": "Stem 01: Brooklyn Cypher Funk Break"
    },
    {
      "trait_type": "Attack",
      "value": "100",
      "display_type": "number"
    },
    {
      "trait_type": "Defense",
      "value": "91",
      "display_type": "number"
    },
    {
      "trait_type": "Speed",
      "value": "98",
      "display_type": "number"
    },
    {
      "trait_type": "Power Rating",
      "value": "289",
      "display_type": "number"
    },
    {
      "trait_type": "Generation",
      "value": "Genesis"
    }
  ],
  "collection": {
    "name": "BeatBots Genesis",
    "family": "BeatBots"
  },
  "properties": {
    "files": [
      {
        "uri": "648.jpg",
        "type": "image/jpeg"
      }
    ],
    "category": "image",
    "creators": [
      {
        "address": "3v2VAud6JVQ62EuRaTRkKuswKJCvgaAUEJce8A1US68d",
        "share": 85
      },
      {
        "address": "CnTMpsERhBucZwFngRny36fSfMasJ4zCisJctmUoPqMQ",
        "share": 15
      }
    ]
  }
}
