{
  "name": "BeatBot Genesis #529",
  "symbol": "BEAT",
  "description": "BeatBot Genesis #529 of the Electro-Soul Alchemists. Built to dominate the rhythm battlefield with Harmonic Resonance (+25% Points on Hold Notes).",
  "seller_fee_basis_points": 500,
  "image": "529.jpg",
  "external_url": "https://playbeatbots.com",
  "attributes": [
    {
      "trait_type": "Clan",
      "value": "Electro-Soul Alchemists"
    },
    {
      "trait_type": "Rarity Tier",
      "value": "Core Battler"
    },
    {
      "trait_type": "Visual Edition",
      "value": "V1 OG WAREHOUSE"
    },
    {
      "trait_type": "Head Chassis",
      "value": "Vintage Ribbon Mic Antenna"
    },
    {
      "trait_type": "Audio Chest Rig",
      "value": "Eurorack Modular Synth Ribs"
    },
    {
      "trait_type": "Stage Backdrop",
      "value": "Red Rocks Starlight Stage"
    },
    {
      "trait_type": "Battle Ability",
      "value": "Harmonic Resonance (+25% Points on Hold Notes)"
    },
    {
      "trait_type": "Sound Profile",
      "value": "Warm Tube Harmonics & Soulful MPC Grooves"
    },
    {
      "trait_type": "Base BPM",
      "value": "90",
      "display_type": "number"
    },
    {
      "trait_type": "Audio Stem",
      "value": "Stem 01: Soulful MPC Vinyl Groove"
    },
    {
      "trait_type": "Attack",
      "value": "92",
      "display_type": "number"
    },
    {
      "trait_type": "Defense",
      "value": "89",
      "display_type": "number"
    },
    {
      "trait_type": "Speed",
      "value": "97",
      "display_type": "number"
    },
    {
      "trait_type": "Power Rating",
      "value": "278",
      "display_type": "number"
    },
    {
      "trait_type": "Generation",
      "value": "Genesis"
    }
  ],
  "collection": {
    "name": "BeatBots Genesis",
    "family": "BeatBots"
  },
  "properties": {
    "files": [
      {
        "uri": "529.jpg",
        "type": "image/jpeg"
      }
    ],
    "category": "image",
    "creators": [
      {
        "address": "3v2VAud6JVQ62EuRaTRkKuswKJCvgaAUEJce8A1US68d",
        "share": 85
      },
      {
        "address": "CnTMpsERhBucZwFngRny36fSfMasJ4zCisJctmUoPqMQ",
        "share": 15
      }
    ]
  }
}
