{
  "name": "BeatBot Genesis #069",
  "symbol": "BEAT",
  "description": "BeatBot Genesis #069 of the Electro-Soul Alchemists. Built to dominate the rhythm battlefield with Harmonic Resonance (+25% Points on Hold Notes).",
  "seller_fee_basis_points": 500,
  "image": "69.jpg",
  "external_url": "https://playbeatbots.com",
  "attributes": [
    {
      "trait_type": "Clan",
      "value": "Electro-Soul Alchemists"
    },
    {
      "trait_type": "Rarity Tier",
      "value": "Legendary Master"
    },
    {
      "trait_type": "Visual Edition",
      "value": "V1 OG WAREHOUSE"
    },
    {
      "trait_type": "Head Chassis",
      "value": "Holographic Color Map Visor"
    },
    {
      "trait_type": "Audio Chest Rig",
      "value": "16-Pad MPC Drum Sampler"
    },
    {
      "trait_type": "Stage Backdrop",
      "value": "Abandoned Brick Warehouse"
    },
    {
      "trait_type": "Battle Ability",
      "value": "Harmonic Resonance (+25% Points on Hold Notes)"
    },
    {
      "trait_type": "Sound Profile",
      "value": "Warm Tube Harmonics & Soulful MPC Grooves"
    },
    {
      "trait_type": "Base BPM",
      "value": "90",
      "display_type": "number"
    },
    {
      "trait_type": "Audio Stem",
      "value": "Stem 03: Laser Canopy Synth Lead"
    },
    {
      "trait_type": "Attack",
      "value": "94",
      "display_type": "number"
    },
    {
      "trait_type": "Defense",
      "value": "91",
      "display_type": "number"
    },
    {
      "trait_type": "Speed",
      "value": "97",
      "display_type": "number"
    },
    {
      "trait_type": "Power Rating",
      "value": "282",
      "display_type": "number"
    },
    {
      "trait_type": "Generation",
      "value": "Genesis"
    }
  ],
  "collection": {
    "name": "BeatBots Genesis",
    "family": "BeatBots"
  },
  "properties": {
    "files": [
      {
        "uri": "69.jpg",
        "type": "image/jpeg"
      }
    ],
    "category": "image",
    "creators": [
      {
        "address": "3v2VAud6JVQ62EuRaTRkKuswKJCvgaAUEJce8A1US68d",
        "share": 85
      },
      {
        "address": "CnTMpsERhBucZwFngRny36fSfMasJ4zCisJctmUoPqMQ",
        "share": 15
      }
    ]
  }
}
